"title","description","video_url","is_featured","is_published"
"Préparation du Bangui aux Épinards","Découvrez en vidéo comment préparer le traditionnel bangui aux épinards, un classique de la cuisine ivoirienne","https://www.youtube.com/watch?v=dQw4w9WgXcQ","true","true"
"Secrets de l'Attieké Parfait","Apprenez tous les secrets pour réussir un attieké parfait à chaque fois","https://www.youtube.com/watch?v=dQw4w9WgXcQ","true","true"
"Visite du Marché d'Adjamé","Suivez-nous dans une visite guidée du célèbre marché d'Adjamé à Abidjan","https://www.youtube.com/watch?v=dQw4w9WgXcQ","false","true"
"Cours en Direct : Riz au Gras","Cours de cuisine en direct pour apprendre à préparer le riz au gras comme un chef","https://www.youtube.com/watch?v=dQw4w9WgXcQ","false","true"
"Les Épices Africaines","Découverte des épices traditionnelles utilisées dans la cuisine africaine","https://www.youtube.com/watch?v=dQw4w9WgXcQ","true","true"